{"candidate_artifact":{"row_count":1024,"schema_version":"partizan.candidate_proposal.v0.1","sha256":"26d51146affa2b21f8a25708353eda2bba4ca80dbd859125c6efca1264585fcf"},"domain":"formal_domain:bitmesh_composed_board_material:v0","executions":{"byte_identical":true,"mode":"separate_python_processes_v1","raw_artifact_sha256":["26d51146affa2b21f8a25708353eda2bba4ca80dbd859125c6efca1264585fcf","26d51146affa2b21f8a25708353eda2bba4ca80dbd859125c6efca1264585fcf"],"run_count":2},"generator":{"code_commit":"604ab9ef1e7bfc4bcc8dd8fb0c19ebdc59cf0e5a","config_sha256":"c6b12d525f6954ad2ffd14f305c4ae338a8a2f0f0dba75a30d8e4ded4771771d","name":"partizan_candidate_pool_generator","random_seed":18084658403807373493,"version":"0.1.0"},"receipt_id":"receipt-sha256:89d07fca4111ee5ba8e8472a84c1f755fd95b3796537b63526516d988c8cd5bf","schema_version":"partizan.candidate_generation_receipt.v0.1","target_id":"target-sha256:8ceee173bf9c9f8e498a058ba15e2d6e4d37ec3ce0b2b7caf8607ac63744ab5b"}
