{"candidate_artifact":{"row_count":1024,"schema_version":"partizan.candidate_proposal.v0.1","sha256":"180646a31053c01f060bef58fdbb4a0f2e0e28e2a58c63cade27b744a4bc3a01"},"domain":"formal_domain:bitmesh_composed_board_material:v0","executions":{"byte_identical":true,"mode":"separate_python_processes_v1","raw_artifact_sha256":["180646a31053c01f060bef58fdbb4a0f2e0e28e2a58c63cade27b744a4bc3a01","180646a31053c01f060bef58fdbb4a0f2e0e28e2a58c63cade27b744a4bc3a01"],"run_count":2},"generator":{"code_commit":"604ab9ef1e7bfc4bcc8dd8fb0c19ebdc59cf0e5a","config_sha256":"46fe98f2bdff1bf01e5243b9aeb64aefd5baa542e0248b1d37ee13d91556a80b","name":"partizan_candidate_pool_generator","random_seed":6801261912781277260,"version":"0.1.0"},"receipt_id":"receipt-sha256:2f4f1b2109fe6f7eb1099918ebcacdd5252dc9f73cff721a9357b01b8c0ccf38","schema_version":"partizan.candidate_generation_receipt.v0.1","target_id":"target-sha256:73492503d817eb3406951fa9fbe127e8f362401b7d9d695163d7e0c4b1ecdc00"}
