{"candidate_artifact":{"row_count":1024,"schema_version":"partizan.candidate_proposal.v0.1","sha256":"46b4c994bcdbb966b70d091a65a5fff4d8137be0ae37c026ae6bfb0faf92cf28"},"domain":"formal_domain:bitmesh_composed_board_material:v0","executions":{"byte_identical":true,"mode":"separate_python_processes_v1","raw_artifact_sha256":["46b4c994bcdbb966b70d091a65a5fff4d8137be0ae37c026ae6bfb0faf92cf28","46b4c994bcdbb966b70d091a65a5fff4d8137be0ae37c026ae6bfb0faf92cf28"],"run_count":2},"generator":{"code_commit":"604ab9ef1e7bfc4bcc8dd8fb0c19ebdc59cf0e5a","config_sha256":"ec15748f3172dd063d819bf325a129aec40744096c0899e4d899bdc5a5f5eee0","name":"partizan_candidate_pool_generator","random_seed":10750487050513559786,"version":"0.1.0"},"receipt_id":"receipt-sha256:0ea8476daa26396ff44d2a104322f17e4b9b492fe8af7e4b1603cb2d2f4e1144","schema_version":"partizan.candidate_generation_receipt.v0.1","target_id":"target-sha256:07de65c35e848be61c6f96872b1b20f3a101efa9b461750c502060842599e0c6"}
