{"candidate_artifact":{"row_count":1024,"schema_version":"partizan.candidate_proposal.v0.1","sha256":"d2a5007461ae2f69193cd3147f4c834bb35228841c20e9fff37e73e353d557b9"},"domain":"formal_domain:bitmesh_composed_board_material:v0","executions":{"byte_identical":true,"mode":"separate_python_processes_v1","raw_artifact_sha256":["d2a5007461ae2f69193cd3147f4c834bb35228841c20e9fff37e73e353d557b9","d2a5007461ae2f69193cd3147f4c834bb35228841c20e9fff37e73e353d557b9"],"run_count":2},"generator":{"code_commit":"604ab9ef1e7bfc4bcc8dd8fb0c19ebdc59cf0e5a","config_sha256":"1d5ce1a35c4729e1caa9d40b25b72ec2dd2e5781e33d4cd76ce38b089cdb03a1","name":"partizan_candidate_pool_generator","random_seed":17672373659205594994,"version":"0.1.0"},"receipt_id":"receipt-sha256:9367450e2061daee9cba8e1ee2fc47bd7b0c76f84484969ae00a189c4b835610","schema_version":"partizan.candidate_generation_receipt.v0.1","target_id":"target-sha256:052f4191fdcbb6fa45716b97cc85949f8c2287c75d532893084955ab7c666122"}
