{"candidate_artifact":{"row_count":1024,"schema_version":"partizan.candidate_proposal.v0.1","sha256":"f1c633e26d5246385d9e6bff88255e79d548c086f85cee02775cb171a7d7e821"},"domain":"formal_domain:bitmesh_composed_board_material:v0","executions":{"byte_identical":true,"mode":"separate_python_processes_v1","raw_artifact_sha256":["f1c633e26d5246385d9e6bff88255e79d548c086f85cee02775cb171a7d7e821","f1c633e26d5246385d9e6bff88255e79d548c086f85cee02775cb171a7d7e821"],"run_count":2},"generator":{"code_commit":"604ab9ef1e7bfc4bcc8dd8fb0c19ebdc59cf0e5a","config_sha256":"e30e39dbbc03b4d951b60eaf7488e597814466aa389e3abe8e83458b494b1714","name":"partizan_candidate_pool_generator","random_seed":15824076400387734239,"version":"0.1.0"},"receipt_id":"receipt-sha256:bc5c7fa381ecc6023b8ec8618ab9afae6aad329be31ef615373820fff6bbbbc6","schema_version":"partizan.candidate_generation_receipt.v0.1","target_id":"target-sha256:f1b5c956d7454a2a939ed8e3a780a7baca58b2b5cddd44313db6f79b2fc20256"}
