{"candidate_artifact":{"row_count":1024,"schema_version":"partizan.candidate_proposal.v0.1","sha256":"3958136c7b78b4a6abc774a58133e6ca841d14cdcfe75d6f9af999a227d5ba68"},"domain":"formal_domain:bitmesh_composed_board_material:v0","executions":{"byte_identical":true,"mode":"separate_python_processes_v1","raw_artifact_sha256":["3958136c7b78b4a6abc774a58133e6ca841d14cdcfe75d6f9af999a227d5ba68","3958136c7b78b4a6abc774a58133e6ca841d14cdcfe75d6f9af999a227d5ba68"],"run_count":2},"generator":{"code_commit":"604ab9ef1e7bfc4bcc8dd8fb0c19ebdc59cf0e5a","config_sha256":"b3538921105ac70919954ecd8339854aeed2e84ddf92dd48dce786206c7d3071","name":"partizan_candidate_pool_generator","random_seed":3801062396562257051,"version":"0.1.0"},"receipt_id":"receipt-sha256:6e70f565e9b58f04e083fd647754975be272b680190bfb502d2edff135ed6cb4","schema_version":"partizan.candidate_generation_receipt.v0.1","target_id":"target-sha256:41bb336e2bee89d4bdf6b5b7a9d9e1c3c8e1fd27da111dbaecac18ae9e553d6a"}
